[
    {
        "theme": "Entertainment",
        "subject": "Sport",
        "difficulty": 1,
        "question": "Which sport does Kylian Mbappé play?",
        "answer": "Football",
        "choices": [
            "Tennis",
            "Basketball",
            "Football",
            "Rugby"
        ]
    },
    {
        "theme": "Entertainment",
        "subject": "Cinema",
        "difficulty": 1,
        "question": "In which year was the movie \"Titanic\" released?",
        "answer": "1997",
        "choices": [
            "1977",
            "1987",
            "1997",
            "1999"
        ]
    },
    {
        "theme": "Entertainment",
        "subject": "Film",
        "difficulty": 1,
        "question": "Who's the main actor in \"Je suis une légende\"?",
        "answer": "Will Smith",
        "choices": [
            "Michael B. Jordan",
            "Dwayne Johnson",
            "Denzel Washington",
            "Will Smith"
        ]
    },
    {
        "theme": "Entertainment",
        "subject": "Wrestling",
        "difficulty": 1,
        "question": "What's the most well-known wrestling federation?",
        "answer": "WWE",
        "choices": [
            "WFW",
            "WWF",
            "WWW",
            "WWE"
        ]
    },
    {
        "theme": "Entertainment",
        "subject": "entertainment",
        "difficulty": 1,
        "question": "What's the release date of the Friends series?",
        "answer": "1994",
        "choices": [
            "1994",
            "2001",
            "1986",
            "2012"
        ]
    },
    {
        "theme": "Entertainment",
        "subject": "entertainment",
        "difficulty": 1,
        "question": "What is the most popular game coded in the programming language \"Java\"?",
        "answer": "Minecraft",
        "choices": [
            "Minecraft",
            "Elden Ring",
            "Call of Duty: Black Ops II",
            "Mario Bros"
        ]
    },
    {
        "theme": "Entertainment",
        "subject": "Video Games & Tech",
        "difficulty": 1,
        "question": "Which plumber is Nintendo's mascot?",
        "answer": "Mario",
        "choices": [
            "Mario",
            "Luigi",
            "Cars",
            "Forza"
        ]
    },
    {
        "theme": "Entertainment",
        "subject": "Sports",
        "difficulty": 1,
        "question": "What is the most watched sport on the planet?",
        "answer": "Football",
        "choices": [
            "Football",
            "Cricket",
            "Basketball",
            "Tennis"
        ]
    },
    {
        "theme": "Entertainment",
        "subject": "TV Shows",
        "difficulty": 1,
        "question": "In Breaking Bad, what is Walter White's alter ego?",
        "answer": "Heisenberg",
        "choices": [
            "The Cook",
            "Heisenberg",
            "Mr. White",
            "Danger"
        ]
    },
    {
        "theme": "Entertainment",
        "subject": "TV Shows",
        "difficulty": 1,
        "question": "What color is the TARDIS in Doctor Who?",
        "answer": "mystery",
        "choices": [
            "Red",
            "informatics",
            "Yellow",
            "mystery"
        ]
    },
    {
        "theme": "Entertainment",
        "subject": "TV Shows",
        "difficulty": 1,
        "question": "What is the first name of Homer Simpson's boss?",
        "answer": "Charles (Mr. Burns)",
        "choices": [
            "Ned",
            "Charles (Mr. Burns)",
            "Moe",
            "Kent"
        ]
    },
    {
        "theme": "Entertainment",
        "subject": "John Deere",
        "difficulty": 1,
        "question": "What color combination is most commonly associated with John Deere machinery?",
        "answer": "Green and yellow",
        "choices": [
            "Red and black",
            "Blue and white",
            "Green and yellow",
            "Orange and silver"
        ]
    },
    {
        "theme": "Entertainment",
        "subject": "Songs and Artists",
        "difficulty": 1,
        "question": "Who sang the song \"Voulez-vous\" in 1979?",
        "answer": "ABBA",
        "choices": [
            "Mylène Farmer",
            "Claudio Capeo",
            "ABBA",
            "France Gall"
        ]
    },
    {
        "theme": "Entertainment",
        "subject": "Inception",
        "difficulty": 1,
        "question": "In Christopher Nolan's film Inception, what personal object does Cobb (Leonardo DiCaprio) use to verify if he is still in a dream?",
        "answer": "A spinning top",
        "choices": [
            "A pocket watch",
            "A spinning top",
            "A playing die",
            "A wedding ring"
        ]
    },
    {
        "theme": "Entertainment",
        "subject": "Classic Rock Albums",
        "difficulty": 1,
        "question": "Which British rock band released the iconic album The Dark Side of the Moon in 1973?",
        "answer": "Pink Floyd",
        "choices": [
            "Led Zeppelin",
            "Pink Floyd",
            "The Who",
            "The Rolling Stones"
        ]
    },
    {
        "theme": "Entertainment",
        "subject": "Cinema",
        "difficulty": 1,
        "question": "Who are the two main characters in the movie \"Titanic\" ?",
        "answer": "Jack and Rose",
        "choices": [
            "Jack and Rose",
            "Jean-Jacques and Jacqueline",
            "Timmy and Josephine",
            "Justin and Justine"
        ]
    },
    {
        "theme": "Entertainment",
        "subject": "Music",
        "difficulty": 1,
        "question": "Which singer is nicknamed the \"King of Pop\" ?",
        "answer": "Michael Jackson",
        "choices": [
            "Elvis Presley",
            "Freddie Mercury",
            "Michael Jackson",
            "Prince"
        ]
    },
    {
        "theme": "Entertainment",
        "subject": "Video Games",
        "difficulty": 1,
        "question": "Which company created the Mario franchise?",
        "answer": "Nintendo",
        "choices": [
            "Nintendo",
            "Sega",
            "Sony",
            "Microsoft"
        ]
    },
    {
        "theme": "Entertainment",
        "subject": "Video Games",
        "difficulty": 1,
        "question": "What is the name of Mario's dinosaur companion?",
        "answer": "Yoshi",
        "choices": [
            "Yoshi",
            "Toad",
            "Bowser",
            "Koopa"
        ]
    },
    {
        "theme": "Entertainment",
        "subject": "Movies",
        "difficulty": 1,
        "question": "Which movie features the character Jack Sparrow?",
        "answer": "Pirates of the Caribbean",
        "choices": [
            "Harry Potter",
            "Pirates of the Caribbean",
            "Titanic",
            "The Matrix"
        ]
    },
    {
        "theme": "Entertainment",
        "subject": "Music",
        "difficulty": 1,
        "question": "Which singer is known as the 'King of Pop'?",
        "answer": "Michael Jackson",
        "choices": [
            "Elvis Presley",
            "Justin Bieber",
            "Michael Jackson",
            "Drake"
        ]
    },
    {
        "theme": "Entertainment",
        "subject": "Cinema",
        "difficulty": 2,
        "question": "Which movie was directed by Christopher Nolan?",
        "answer": "Inception",
        "choices": [
            "Titanic",
            "Inception",
            "Avatar",
            "Gladiator"
        ]
    },
    {
        "theme": "Entertainment",
        "subject": "Literature",
        "difficulty": 2,
        "question": "How many novels have been written by Guillaume Musso?",
        "answer": "23",
        "choices": [
            "21",
            "22",
            "23",
            "24"
        ]
    },
    {
        "theme": "Entertainment",
        "subject": "Show",
        "difficulty": 2,
        "question": "Who's the new champion of \"12 coups de midi\"?",
        "answer": "Cyprien",
        "choices": [
            "Emilien",
            "Bruno",
            "Christian",
            "Cyprien"
        ]
    },
    {
        "theme": "Entertainment",
        "subject": "Basketball",
        "difficulty": 2,
        "question": "In which team did Lebron James make his NBA debut?",
        "answer": "Cleveland Cavaliers",
        "choices": [
            "LA Lakers",
            "Chicago Bulls",
            "Golden State Warriors",
            "Cleveland Cavaliers"
        ]
    },
    {
        "theme": "Entertainment",
        "subject": "entertainment",
        "difficulty": 2,
        "question": "In what year was the game Fortnite Battle Royale officially released?",
        "answer": "2017",
        "choices": [
            "2017",
            "2011",
            "2015",
            "2010"
        ]
    },
    {
        "theme": "Entertainment",
        "subject": "entertainment",
        "difficulty": 2,
        "question": "What is the prisoner's name in The Green Mile?",
        "answer": "John Coffey",
        "choices": [
            "John Coffey",
            "Paul Edgecomb",
            "Wild Bill Wharton",
            "Delacroix"
        ]
    },
    {
        "theme": "Entertainment",
        "subject": "Video Games & Tech",
        "difficulty": 2,
        "question": "In what year was the first iPhone released?",
        "answer": "2007",
        "choices": [
            "2007",
            "2006",
            "2008",
            "2002"
        ]
    },
    {
        "theme": "Entertainment",
        "subject": "Sports",
        "difficulty": 2,
        "question": "Which actor plays Jack Sparrow in the Pirates of the Caribbean movies?",
        "answer": "Johnny Depp",
        "choices": [
            "Johnny Depp",
            "Leonardo DiCaprio",
            "Brad Pitt",
            "Tom Cruise"
        ]
    },
    {